,fname,text
9,fire.ai ?96dff191 page=3,"fire.ai ?96dff191 page=3. Campfire | Conversational A.I. Implementation Partner AboutCasesBlogPartnersJobs👋 Let's ChatConversational AI allows people to focus on what's importantDon’t waste time on repetitive tasks and questions. With conversational AI you can scale your user interactions without increasing your operational costs.Let's Chat !What we doWe use natural language processing (NLP) to help you automate anything that involves language. Our team of AI consultants, conversational designers and full-stack developers deliver projects that pay for themselves within a year.ChatbotsFrom simple Q&A bots to complex virtual assistants, we build chatbots that automate internal and external processes for customer service, HR, sales and marketing teams.Read moreVoice botsUsing speech-to-text technology, we apply our bot building expertise to spoken conversations. Conversational Process AutomationA lot of business processes are text heavy. We help teams streamline those processes using NLP and NLG to sort, search, tag and summarize text.Natural Language ProcessingWe build, train and clean NLP models on a daily basis. Whether you need help building one from scratch or restoring an old, neglected model, we have a book of best practices to help you reach 90% recognition rates.UX & Conversational DesignGreat conversational AI experiences require more than great tech. We apply traditional UX best practices to ensure that bot-user interactions flow and feel natural.Tech IntegrationsThe best automation cases have seamless integrations. We develop custom integrations and APIs so that you can connect your existing tech stack with the conversational channels your users are already using. 📄 Get The Best Bots of Belgium 2022 reportThis 25-page report analyzes 22 of the best Belgian chatbots from 2022. Audited by our CEO and Head of UX, it’s packed with insights and quick-wins that will help you optimize any chatbot.GET YOUR COPYSome of our work AI can support almost any company, in any industry and in any country. Check out the work we did for some our clients below.NextSam and Sono are chatbots that troubleshoot your login issuesVIEW THE FULL CASE >>The natural evolution of mobile banking into conversational bankingVIEW THE FULL CASE >>PreviousDo you have tasks that need to be automated?Don't be shy! Reach out and say hello!Let's Chat!CompanyWorkPartnersJobsResourcesBlogThe Best Bots 2022AboutAbout CampfirePrivacy policyCopyright © 2022 Campfire AIThis site uses cookiesWe care about your data, and we'd use cookies only to improve your experience. By using this website, you accept our Cookies Policy.Accept "
10,fire.ai cases rawbank,fire.ai cases rawbank. Not Found Page Not FoundThe page you are looking for doesn't exist or has been moved.Go Back to Safety
11,fire.ai post what is conversational banking,"fire.ai post what is conversational banking. What is conversational banking? AboutCasesBlogPartnersJobs👋 Let's ChatWhat is conversational banking?November 4, 2022Conversational banking is exactly what it sounds like: it’s when a financial institution uses conversational AI to answer banking and insurance questions. Put simply, it’s a bank’s chatbot.‍Conversational banking uses natural language processing (NLP), which is a fancy way of saying AI for words. Like any other chatbot, we built the NLP model using intents, expressions, entities and flows.‍‍‍‍‍‍‍‍‍‍When a user asks a chatbot a question, we refer to that as an expression. For example, the user asks, “How do I cancel my credit card?” The bot processes the user’s expression and compares it to the different expressions within its NLP model. Each expression within the NLP model is associated with a specific intent, or answer to an expected question. The bot then assigns a confidence score to each intent, and based on the different thresholds and rules that we define, it responds to the user with the appropriate answer.A look into how a chatbot assigns confidence scores‍Why is conversational AI interesting for the banking sector?​Banking is the perfect business case for conversational AI because banks and insurance providers have thousands of customers who use their services multiple times a day. This inevitably leads to problems that need solving and questions that need answering.Most of the incoming questions are repetitive, easy to recognize and easy to answer. This is the trifecta for conversational AI automation, making it a win-win for banks and customers.‍‍💾 Save resources​On average, banks implementing a basic chatbot save between 10-20% of an agent’s time. The customer support agents can repurpose their saved time to focus on more complex cases that need human attention.‍❌ Reduce human error​Humans make mistakes; it just happens sometimes. Whereas a chatbot follows standardized, pre-programmed logic, making it almost impossible to make mistakes.‍🤳 Interact with customers where they are​A chatbot can live almost anywhere: on your website, in your app, WhatsApp, Instagram, Twitter, etc. By placing your chatbot where your customers already are, you widen your customer reach and reduce the barrier to connect.‍💸 Focus on upselling​Instead of spending time answering the same question 20 times a day, a customer support agent can delegate these types of tasks to a chatbot. They then have the time to focus on resolving complex client issues and upselling clients.‍‍Benefits for customers​⚡ Instant answers​A chatbot is available 24/7 and can answer a user’s question in seconds. This is a significant contrast when compared to more traditional question-and-answer approaches. For example, think about when a customer had to wait on the phone line for 10-30 minutes for a representative to pick up or send an email and wait a few days for a response. With a chatbot, your customers ask whenever is most convenient for them and they receive an instant response. There are no opening hours, no queues and no waiting times.‍🎯 Personalized experiences​It’s easy to connect your chatbot to your CRM system. This allows you to identify your customers and tailor the conversation to their needs and profile. For example, if you’re logged into your banking app and trying to file an insurance claim, the bot can look up your existing policy and respond with an answer tailored to your insurance policy. Each user’s experience with the chatbot is customized and unique.‍💬 Interactive communication​It’s much more enjoyable and efficient to have an interactive conversation rather than trying to fill out a form that doesn’t allow you to express your problem or fighting with an IVR system that doesn’t understand your request. Chatbots are flexible and trained to solve problems and answer questions.‍🔮 Omni-channel accessibilityWe can place a chatbot on almost any channel, making it much easier for your customers to connect with you via the channel that they prefer. This allows them to seamlessly switch between channels and makes it a more convenient experience for everyone.‍What are the best use cases for conversational banking?​Like any other industry, a chatbot can support all types of departments and roles. Here are some different implementations for banking chatbots:Answer frequently asked questionsSell new plans and upgradesRegister and onboard new clientsRemind users of upcoming payments and deadlinesCoach and motivate users to stick to their budget and savings goalsRequest a new card readerRaise your daily limitPlan your budgetCheck your balanceMake a transferPay your billsFile an insurance claimIf you’re eager to dive deeper into some actual business cases, check out our work for Argenta and Rawbank.‍What’s next?​Banks will inevitably continue adopting conversational AI to automate frequently asked questions, execute transactions and streamline processes. Financial institutions that don’t make this switch won’t be able to sustain the increasing volume of incoming questions and remain competitive.Are you interested in implementing a chatbot at your company? Reach out to Alexis for a quick chat.‍NameEmail AddressCOMPANY* I read and agree with Campfire’s Privacy PolicyHeck yes! Campfire can keep me updated on their growth, news, thoughts and musings!Thanks for that! Here's the download link 👇download nowOops! Something went wrong while submitting the form.Do you have tasks that need to be automated?Today is the day to build the business of your dreams. Share your mission with the world — and blow your customers away.Let's Chat!CompanyWorkPartnersJobsResourcesBlogThe Best Bots 2022AboutAbout CampfirePrivacy policyCopyright © 2022 Campfire AIThis site uses cookiesWe care about your data, and we'd use cookies only to improve your experience. By using this website, you accept our Cookies Policy.Accept"
12,fire.ai smores how to scope your next chatbot project,"fire.ai smores how to scope your next chatbot project. How to scope your next chatbot project AboutCasesBlogPartnersJobs👋 Let's ChatHow to scope your next chatbot projectNovember 4, 2022When sitting down to decide what information your chatbot should know (i.e. scoping your chatbot), you’re actually trying to predict what questions your future users will ask. And by giving your users a keyboard, you’re opening up the list of possible questions to include literally everything and anything. ‍When a user asks a question, your bot will use natural language processing (NLP) to try and determine the intent (or purpose) of your user’s question. These intents are the building blocks of your bot’s knowledge. For your bot to recognize an intent, you need to identify what questions your users will ask, build an NLP model based on that information and train your bot with +40 expressions per intent. ‍There’s a big difference between what your bot could know and what it should know. But to get to the should, you need to start with the could. Below we share our favorite places to look for possible intents and our tips on selecting the most impactful ones. Because at the end of the day, your chatbot needs to save you time and money.‍Gather all the possible intents​The scoping phase of a chatbot project is when you gather all the possible intents. This is the time to dig out a magnifying glass and play Sherlock Holmes. Just like a detective, you need to poke around in the dusty corners, interview witnesses and listen for the truth. This is the phase where you’ll look into all the possible questions your bot could answer. If you’re feeling impatient and want to know what your bot should answer, skip ahead to the next section.‍Start with the FAQs​There’s a reason companies have FAQs– they’re the select set of questions that users ask the most. Not only do you already know that these are high-volume questions, but the content is also structured and the answers are there! It's almost a perfect outline for your chatbot's scope. All you need to do is rework the questions to match a single intent and rewrite the copy to fit a conversation.‍Chat with your customer support team​No one knows your users better than your customer support agents. They interact with and solve your users’ questions and issues daily. Most customer support teams have a knowledge library of questions and answers beyond the basic FAQs. Similar to an FAQ, you can assume that users ask these questions repeatedly, and there’s already a clear outline of how the bot should answer.‍Customer support teams are also your gateway to the “information universe.” They manage the access to the digital archive of all past user conversations, and in most cases, they classify these conversations with topics, tags, and have template responses. This is a friendly warning that reading through real user conversations can lead you down the black hole of information overload, but we swear that this is the best way to understand who your bot will talk to and how they’ll respond to it. ‍In case you’re still not convinced, the final reason to involve your customer support agents in scoping your chatbot is that they’ll be your bot’s direct colleagues. When your bot can’t close a user request on its own, your customer support agents will take over the conversation via an offload flow. You need to know how they work to design a bot that will help them, and they need to understand how the bot will work to help users better.‍Review company documentation​Is there an onboarding manual? Or a handbook of company processes? Since this is information that your company wants to share with employees, partners, customers and more, it’s a great thing to read for inspiration. You’ll be pleasantly surprised how many intents you can find in a basic About-CompanyX.pdf.‍Identify the manual processes​Chatbots exist to automate repetitive tasks. Basic manual processes inspire some of the best intents and future conversational flows.A common manual process is data capture. You can easily put the bot in charge of collecting and updating user data, so that your human colleagues can focus on more complex tasks. Managing appointments, routing to the right queue and sending reminders are other processes that a chatbot can easily take over.‍Turn user questions into chatbot intents​Questions and intents are similar, but not the same. A question is literally what your user asks, while an intent is the purpose of what your user asks. For example, a user asks Hey Google! What’s the number for Amy’s Pizza? The Hey Google… is the question, but 01-restaurant-contact-info is the intent.Transforming a question into an intent isn’t always easy. The key is to capture the essence in one to three words. A good rule of thumb is that if your intent doesn’t fit on a post-it, it’s too long.‍Choose the best intents​Now that you have a collection of possible intents, it’s time to decide which intents will have the largest potential impact and therefore, the highest priority. For a pilot project, we recommend starting with ~20 intents. It’s always better to get a small set of intents working well before making a dumpster of half-understood intents.‍Look for the trifecta​The best intents are the ones that are repetitive, easy to recognize and easy to answer. When you find this trifecta, put this intent at the top of your implementation backlog.But how do you know if you have a trifecta? We use a systematic framework to visualize which intents will have the largest potential impact.‍Recognizability: Can a bot easily recognize this intent? Is it clear and unique, or very vague, or similar to other intents?‍Repetitiveness: How frequent is this intent? Will it be triggered 200 times a day or twice a day?  ‍Easiness: How simple or complex is it to implement this intent? Do we need to use APIs, create a microservice, etc.? ‍Review each intent and give it a score from 1-10 for recognizable and repetitive (1 being the least and 10 being the most). Then give the intent a score from 1-5 based on how easy it’ll be to implement (1 being the easiest and 5 being the most difficult). Now it’s time to map each intent on a graph; recognizability is on the y-axis and repetitiveness is on the x-axis. Once you have the coordinates for an intent, mark it with its easiness score.A cluster in the top right quadrant will appear. These are the intents that you should prioritize for your chatbot. Start with the easiest intents to implement, and then work your way up through the more difficult ones.Any intents that don’t make the list for the pilot should go on your backlog so that you can pick them up to include in future releases.‍A chatbot’s knowledge isn’t static​Launching your bot is only the beginning. This is one of our favorite diagrams of all time because it’s so simple, yet so accurate 👇The best source of new intents for your chatbot comes from its users. Once your bot is live, take time to review the incoming conversations. This allows you to make sure that the bot’s recognizing existing intents correctly and to see what other questions users ask that are currently not in scope. ‍Look for patterns and figure out how the bot could answer that question instead of putting it in a not understood flow. Your priority should be to make every experience a neutral or positive experience for the user. Looking at the missed questions gives you all the necessary information to increase your bot’s knowledge. The best bots grow continuously and are updated regularly to answer actual user questions. NameEmail AddressCOMPANY* I read and agree with Campfire’s Privacy PolicyHeck yes! Campfire can keep me updated on their growth, news, thoughts and musings!Thanks for that! Here's the download link 👇download nowOops! Something went wrong while submitting the form.Do you have tasks that need to be automated?Today is the day to build the business of your dreams. Share your mission with the world — and blow your customers away.Let's Chat!CompanyWorkPartnersJobsResourcesBlogThe Best Bots 2022AboutAbout CampfirePrivacy policyCopyright © 2022 Campfire AIThis site uses cookiesWe care about your data, and we'd use cookies only to improve your experience. By using this website, you accept our Cookies Policy.Accept"
13,fire.ai post how to audit your chatbot in 20 min or less,"fire.ai post how to audit your chatbot in 20 min or less. How to audit your chatbot in 20 min. or less AboutCasesBlogPartnersJobs👋 Let's ChatHow to audit your chatbot in 20 min. or lessMarch 7, 2023As a boutique consulting company specialized in conversational AI, we spend a lot of time auditing chatbots. We’ve pretty much got it down to a science at this point. Using our audit methodology and checklist, we’ll walk you through how to prep, test and score your bot in less than 20 minutes. ‍Always use an audit checklistFirst and foremost, use checklist to help you audit your chatbot. Why? Because unfortunately, our minds aren’t as sharp at 25+ as they were at 12… we forget things. Not only does the checklist help you remember everything, it also keeps you focused and instantly highlights opportunities for improvement. ‍Don’t have an audit checklist? We’ve got you covered! Our audit checklist is a robust one-pager that covers the four most important pillars that make up a strong chatbot:NLP qualityConversational designStructure and flowsVisualizationScroll down to the end of this post to download your own copy 👇‍Step 1: Prep your questions (~5 min.)We recommend prepping 15 questions that you can ask your bot. We always start from a generic list of 10 questions and then adapt those based on the target audience using the bot, the placement of the bot and the company. If you’re lacking inspiration, you can always check out our base list of questions in this article.‍Step 2: Test the bot (~10 min.)Now it’s time to test your bot! Ask the bot your 15 questions and note how it responds: true positive, false positive, false negative or true negative. Then run through the rest of the checklist testing the different criteria and recording the results. Once you reach the end it’s time to move on to the next step.‍Step 3: Tally up the score (~5 min.)This is the easy part… Add up the scores for each section and then calculate the total score out of 50. You’ll immediately see which areas the bot performs well and which areas need improvement. This will help you focus your optimization efforts.‍Other tricks for auditing your chatbot quicklyAfter testing 100+ bots, we’ve perfected the bot testing setup. Here are a few habits that we use to make sure our tests run smoothly.‍Use two screensAfter a lot of trial and error, we found that the best way to efficiently test a chatbot is to use two screens. We like the open the bot on our laptop and have the audit checklist and questions open on our second screen. This setup makes it easy to copy and paste the questions into the bot instead of losing time typing them out. ‍Take notes as you goThis is crucial. As you’re moving quickly, ideas come and go just as quickly. I promise you won’t regret this. Plus it makes referring back to a test a few hours, days or months later so much easier. ‍Use a color code systemColor allows us to see quickly how a bot performed on NLP quality. We highlight true positives in green, false positives in red, false negatives in orange and leave true negatives as is. You can use any color combination that you like. The idea is to pick a set of colors that stand out from one another to make counting at the end quick and easy. ‍Have all your devices near youThis is a simple one, but make sure you have a tablet and phone next to you so you don’t have to get up partway through testing and try to find it. ‍Record your testing sessionScreen recordings are a lifesaver. AI is like a black box and weird stuff happens. It just does. After experiencing weird things and then trying to recreate them with different results, we resorted to recording each testing session. This allows us to revisit a test later on as well as show our developers and conversational AI consultants what went wrong so they can look into the conversation history and pinpoint the error. Audit your bot in <20 minutesFill out your info on the right to receive a download link for an editable version of our Bot Audit Checklist!NameEmail AddressCOMPANY* I read and agree with Campfire’s Privacy PolicyHeck yes! Campfire can keep me updated on their growth, news, thoughts and musings!Thanks for that! Here's the download link 👇download nowOops! Something went wrong while submitting the form.Do you have tasks that need to be automated?Today is the day to build the business of your dreams. Share your mission with the world — and blow your customers away.Let's Chat!CompanyWorkPartnersJobsResourcesBlogThe Best Bots 2022AboutAbout CampfirePrivacy policyCopyright © 2022 Campfire AIThis site uses cookiesWe care about your data, and we'd use cookies only to improve your experience. By using this website, you accept our Cookies Policy.Accept"
14,fire.ai best bots of belgium 2022,"fire.ai best bots of belgium 2022. The Best Bots of Belgium 2022 | Campfire AI AboutCasesBlogPartnersJobs👋 Let's ChatUncover the best chatbots in Belgium 👇This report analyzes 22 of the best Belgian chatbots from 2022. In addition to the full  list of ranked results, you’ll receive:✅  A walk-through of our bot auditing methodology✅  A copy of our auditing checklist✅  A list of chatbot quick-wins and opportunities* FULL Name* WORK Email* COMPANY* I read and agree with Campfire’s Privacy PolicyHeck yes! Campfire can keep me updated on their growth, news, thoughts and musings!* Required fieldsThanks for that! Here's the download link 👇📄 Open the pDFOops! Something went wrong while submitting the form.CompanyWorkPartnersJobsResourcesBlogThe Best Bots 2022AboutAbout CampfirePrivacy policyCopyright © 2022 Campfire AIThis site uses cookiesWe care about your data, and we'd use cookies only to improve your experience. By using this website, you accept our Cookies Policy.Accept "
