,fname,text
0,fire.ai post how to build a chatbot that doesnt suck,"fire.ai post how to build a chatbot that doesnt suck. How to build a chatbot that doesn’t suck AboutCasesBlogPartnersJobs👋 Let's ChatHow to build a chatbot that doesn’t suckMarch 2, 20234 lessons I learned from building over 50 chatbots on 5 continentsAlmost everyone agrees that automated conversations can add value. As a customer, it’s much easier if you can communicate with a company or organization just as you do with your friends and family. No one likes to sit on hold in a telephone queue or wait three days for a response to their email. Instead, if AI could recognize your question, and resolve it or transfer it to the right person, the added value for both the user and the business is immense. That’s why “going conversational” is the next step forward in the way companies interact and communicate with their customers. However, for a technology that has so much potential, I always wonder why there are so many unsuccessful voice and chatbots? If you own a computer or a smartphone, then it’s safe to say that you’ve had a conversation with a chatbot that makes you so frustrated, you want to throw your device out the window. Bots aim to make people’s lives easier, not add problems, so why are a majority of people’s interactions with bots so frustrating? The technology is there; it’s the implementation approach that needs updating. Over the last two and half years, I built more than 50 chatbots for companies from all industries in Europe, Africa, Asia and the Americas. As with anything, there are always common mistakes that I see teams repeat when tackling a new chatbot project. There are four big lessons, that I learned and I promise you that, if you stick to these lessons, you’ll not only build a bot that doesn’t suck, but you’ll build a bot that solves problems for your users and makes them feel heard and understood. ‍Lesson 1: Anticipate the out of scope A chatbot project is an AI project, but frequently it’s run like a traditional IT project. The best way to explain the difference in approaches to a new project team is by comparing building a chatbot to building a website. A website has a predefined scope. The team agrees on the intended users, designs journeys to match their objectives and essentially decides which buttons appear where and what happens when the user clicks. The user’s actions are finite. Once there’s a V1 of the website, the team tests to make sure everything works cross-device, that the buttons lead where they’re supposed to, etc. They correct any bugs and set the site live!Now building a chatbot is an entirely different story. When you build a chatbot, you start with a scope. The team agrees on an information architecture, defines the bot’s knowledge and responses, trains the NLP model, etc. However, we can’t define the user journeys, because by giving the user a keyboard, the user’s actions become infinite. A keyboard opens up the possibility for a user to say literally anything and everything. This highlights the beauty and the potential of AI; instead of trying to understand how a website works and falling into a predefined journey, the user defines their own journey and experience with the chatbot. This means that even though we decide on an initial scope, people can still say whatever they want outside of this scope. And that can create issues that I refer to as false positives and true negatives.‍Example 1: False positivesLet’s say someone asks something that’s out of your scope. You can build your happy flows as well as you like, but when someone asks something that’s out of your scope, it can very easily match an intent that you have in scope. Plus, the better and more robust your in-scope NLP model is, the chances increase that your user gets a false positive. Example of an NLP model giving a false positiveExample 2: True negativesWhen someone says something that’s out of scope, and the bot correctly doesn’t understand it. This is a true negative, which means the bot doesn’t know how to answer the question and usually responds with some sort of “not understood” sentence that asks the user to rephrase their question. However, the phrasing isn’t the issue, and rephrasing the question won’t solve the problem, because the question is out of scope and considered a true not understood. The user and the bot become stuck in a “not understood” loop. Example of an NLP model handling a true negativeSo, how can you avoid false positives and plan for true negatives? First, create what I refer to as “99-intents.” These are intents that capture categories and intents that aren’t in scope. Their main purpose is to attract out of scope questions and define the correct next steps for the user. Second, make sure you correctly handle “not understood.” Don’t ask the user to rephrase. Instead, focus on how you can get the user to a solution as quickly as possible. I’ll dive into this more in Lesson 4.‍Lesson 2: Organize intents into a hierarchyLet’s use a banking bot for this lesson. A customer types that they lost their card, and the bot asks which card: debit or credit. The bot needs to know which card the user lost because the process is different depending on the card type. Great! Nothing bad happened yet :)Now the next user says that they lost their credit card, and again the bot asks which card they lost. The bot correctly recognized the intent, but it’s asking for additional information that the user already gave. This makes the user feel like the bot didn’t properly understand them because no one likes to repeat themselves. The third user types that they lost their Amex Gold. The bot follows up by asking which card and the user repeats Amex Gold. The user is now stuck in a loop because this bot only expects debit or credit as an answer and doesn’t realize Amex Gold is a credit card.To make sure this doesn’t happen, you need to organize your content into a knowledge hierarchy. It goes from very broad to very specific. When a user asks a question, we want the bot to give the most specific answer possible. For example, if someone says that they lost their Amex Gold, we don’t want to ask them if they lost their debit or their credit card. It’s this possibility to immediately narrow in on the specific that makes AI so useful. Not only can users talk the way they normally do, they feel heard and can immediately receive an answer to their specific problem. Whereas, if this was a website, they’d have to click 1, 2, 3, 4, 5, or 6 times to access the Amex Gold information.So how can you make sure we access the deepest level of information within a given intent? First, group all the similar intents and expressions together. Then, organize them from broad to specific. Finally, use different intents and specific entities for recognition and figuring out how “specific” the answer should be. ‍Lesson 3: Expect unusual expressionsKeeping the banking theme, let’s start with an example that most banks in Belgium struggle with. We’re making an intent for users requesting a new version of this little device  👇What would you call this? Most people would say “card reader.” Some say bank device, pin machine, digipass… In Belgium, people also say ‘bakje’ or ‘kaske’ which means small tray or container. Some people don’t even use a specific word for this, they just say something like “the thing I use to pay online.” When you start interacting with your customers, you realize that everyone expresses themselves differently. As humans, it’s pretty easy for us to understand “the thing I use to pay online,” because we have context and can quickly figure out what the person means. However, a bot only knows what you teach it, so you need to make sure that all these variations are part of your AI model. This applies to single words, but also to sentences and situations. For example, when someone wants to express that their card is broken, they might say that while getting out of their car, they dropped their card in the door and closed it. This brings up the next question: how far do you need to go with this? In the above example, do you really want the bot to understand this? If you add this to the AI model, you’ll have to include all kinds of words that have nothing to do with losing a card. And later on, as soon as someone mentions a car or a door, the AI will start thinking of a broken card. That might not be the result that you’re aiming for. There’s always a tradeoff when adding words and expressions that are unusual and divert from the more straightforward expressions because you don’t want to take it too far. If a human would have trouble understanding what a person really means, there’s no way we can expect a bot to understand. You should aim to train your NLP model to recognize 90% of the incoming user questions that are in scope. Depending on the bot and scope, you can get up to a 95% recognition rate, but I typically never train above that since the remaining 5% are usually edge cases and exceptions. So how can you anticipate all the creative ways users will describe an item or situation? It’s all about testing and optimizing. When you first launch your bot, your NLP model will recognize ~70% of incoming, in-scope questions. You’ll need to review the incoming questions, update the NLP model with new expressions, set it live and repeat until you reach 90% recognition. Remember, a chatbot is an AI project that uses confidence scores, which means nothing is ever black and white. ‍‍Lesson 4: Remove: “Sorry, I don’t know” Often, when a bot doesn’t understand someone, the reply is “Sorry, I don’t know the answer.”The problem with that approach is that it doesn’t help the user and it creates a negative experience. For example, when your wifi doesn’t work, you contact your provider via their chatbot. If the bot doesn’t understand what you said and responds with “Sorry, I don’t know,” you now have two problems: your wifi doesn’t work and the bot doesn’t understand you. The difference in a user's emotions before and after using a bad chatbotThis goes together with what I mentioned earlier about in-scope and out of scope expressions. If someone says something that’s out of scope, the bot needs to realize that and provide an alternative solution. Going back to the wifi example. Instead of saying I don’t’ know. The bot can direct the user to an FAQ page, provide a link to a video that walks the user through resetting the modem, give the user the customer support phone number, offer to connect the user to a live agent, etc. There are so many ways the bot can help the user get closer to a solution, even if it can’t solve the problem on its own. By helping the user get closer to a solution, the bot adds value, rather than adding frustration. At Campfire AI, we always develop an elaborate flow of safety nets. That way we make sure we’ve exhausted every possible way to help the user before wrapping up. A not understood flow that triggers multiple safety nets before wrapping up‍Applying these lessons so your next chatbot doesn't suckI never said it would be easy to build a chatbot that doesn’t suck ;) But, I promise that if you apply these four lessons, you’ll have a chatbot that helps bring your users closer to a solution. ‍‍About the authorIvan accidentally found himself in the world of conversational AI when interviewing for a job at a marketing agency back in 2018. After the interview, the agency called him back and said that he was a perfect fit for the AI Team. From there, the rest is history. In 2020, he co-founded Campfire AI with Alexis Safarikas. As COO and Managing Partner, Ivan is the master of systems and creator of processes.NameEmail AddressCOMPANY* I read and agree with Campfire’s Privacy PolicyHeck yes! Campfire can keep me updated on their growth, news, thoughts and musings!Thanks for that! Here's the download link 👇download nowOops! Something went wrong while submitting the form.Do you have tasks that need to be automated?Today is the day to build the business of your dreams. Share your mission with the world — and blow your customers away.Let's Chat!CompanyWorkPartnersJobsResourcesBlogThe Best Bots 2022AboutAbout CampfirePrivacy policyCopyright © 2022 Campfire AIThis site uses cookiesWe care about your data, and we'd use cookies only to improve your experience. By using this website, you accept our Cookies Policy.Accept"
1,fire.ai job posts marketing intern,"fire.ai job posts marketing intern. Marketing Intern AboutCasesBlogPartnersJobs👋 Let's ChatMarketing InternBrussels | 3 to 6 monthsAs an intern, you’re at the beginning of your career and we recognize that you’re here to learn. We don’t expect you to have 3 years of industry experience, a Pulitzer Prize or a viral TikTok campaign. We're simply looking for someone who's eager to discover the world of conversational AI and loves to write/design.Apply nowWe’re looking for people who contribute to our good vibes and are eager to solve problems. So if you like to write, design and share your ideas with others, you should definitely apply.👨‍💻 What you'll doReport directly to the Head of Creative & UX and work closely with both Marketing and SalesWrite and publish blog posts on our website that position Campfire as a thought leader in conversational AI (ideation, writing, editing, SEO optimization, website publishing)Create, publish and community manage posts on Campfire's LinkedIn (ideation, writing, designing, publishing, monitoring, moderating)Support Sales and Marketing in prepping for upcoming events, including creating communication/promotional materials, building presentations, drafting speeches, contacting stakeholders, etc. Work on different marketing campaigns, including setting up, monitoring, optimizing and analyzing results‍🕵️‍♂️ What we're looking forYou're available to work 3-5 days per week for 3-6 months in BrusselsYou actually enjoy writing and don't use ChatGPT to draft all your communicationYou're a strong writer and can proof your own workYou can take complex topics and explain them in way that your 10-year-old cousin can understandYou're self-sufficient and can still complete your work when working remotely Basic website and design skills are a plusFluent in English, spoken and written (other European languages are a plus)You’re curious and a quick learner, and demonstrate a growth mindset‍💸 What you'll receive A crash course in the basics of conversational AI and how it worksMentoring and support from 5 senior profiles with a combined 20+ years’ experience in conversational AIA personalized growth plan with learning objectives based on our Skills MatrixYour transport to the office and lunches are on us (AKA we reimburse your expenses)Sometimes an internship is the best job interview you’ll ever have– Based on your performance we’ll consider you for permanent positions‍Apply nowCompanyWorkPartnersJobsResourcesBlogThe Best Bots 2022AboutAbout CampfirePrivacy policyCopyright © 2022 Campfire AIThis site uses cookiesWe care about your data, and we'd use cookies only to improve your experience. By using this website, you accept our Cookies Policy.Accept"
2,fire.ai case posts a virtual tutor powered by artificial intelligence ai,"fire.ai case posts a virtual tutor powered by artificial intelligence ai. A virtual tutor powered by Artificial Intelligence (AI)​ AboutCasesBlogPartnersJobs👋 Let's ChatA virtual tutor powered by Artificial Intelligence (AI)​Online learning offers students flexibility, but often lacks the guidance and support that's available in a traditional classroom. We worked together with university staff and used A.I. to develop a virtual tutor that guides students through their online course material.​‍The ProblemRemote studying can be a struggle​Every summer, the Singapore Institute of Technology (SIT) runs an online chemistry course for incoming first year students. The course is designed to put everyone on a level playing field. To help students learn chemistry online, we developed a virtual study assistant to complement the online chemistry course.‍The solutionA virtual tutor that's available 24/7In collaboration with the professors and researchers from SIT, we reviewed the different course chapters and developed a hierarchical structure of hints to match the evaluation questions at the end of each chapter. The first hints are more generic, while the second and third hints are more specific to the question.‍We also added the answers to 100+ frequently asked questions that cover more generic chemistry content, such as explaining Avogadro’s Constant, the formula for calculating moles, and the definition of enthalpy or entropy.The resultsEngaging students in meaningful conversation​During the user research phase, 57% of the students indicated that they found the chatbot useful in answering questions. They commented that the chatbot is convenient to use and that having a conversation with a bot is more engaging and interactive than simply googling a question.56% of students also expressed that they would prefer an imperfect chatbot that’s available 24/7 than an instructor available for a limited period of time.‍As part of a larger research project from SIT, we’ll continue optimizing the bot and their team of professors and researchers will continue investigating the impact of a human tutor vs. a virtual tutor on course completion rates. If you’re interested in learning more about SIT’s research, you can read the full research paper here.‍57%OF STUDENTS FOUND THE CHATBOT USEFUL IN ANSWERING QUESTIONS 56%OF STUDENTS PREFER A CHATBOT THAT’S AVAILABLE 24/7 TO AN INSTRUCTOR AVAILABLE FOR A LIMITED PERIOD OF TIME CompanyWorkPartnersJobsResourcesBlogThe Best Bots 2022AboutAbout CampfirePrivacy policyCopyright © 2022 Campfire AIThis site uses cookiesWe care about your data, and we'd use cookies only to improve your experience. By using this website, you accept our Cookies Policy.Accept"
3,fire.ai job posts conversational ai intern,"fire.ai job posts conversational ai intern. Conversational AI Intern AboutCasesBlogPartnersJobs👋 Let's ChatConversational AI InternBrussels | 3 to 6 monthsAs an intern, you’re at the beginning of your career and we recognize that you’re here to learn. We don’t expect you to have 3 years of industry experience, a PhD in data science or to have visited Mars. We're simply looking for someone who's eager to discover the world of conversational AI.Apply nowWe’re looking for people who contribute to our good vibes and are eager to solve problems. So if you like to experiment with new technology and want to build solutions that answer business needs, then you should definitely apply.👨‍💻 What you'll doUse conversational AI tools to build flows and NLP/intent modelsIdentify and analyze business needs to provide high-level budget estimatesApply business logic and integrations to transform simple chatbots into personalized conversational agentsCreate integrations between conversational agents and back-end systems (databases, help desk software, CRMs, …) using (basic) APIs and scriptsDocument learnings and share them with the team‍🕵️‍♂️ What we're looking forYou have an analytical mind and the urge to create order when confronted with large data setsYou have a keen business senseYou have basic Javascript / HTML / CSS coding skills (We’re open to someone with limited prior experience but with a strong willingness and ability to teach themselves)Knowledge of API integrations is a plusYou understand or at least have a strong interest in IT, data, operations, automation and the AI landscapeFluent in English, spoken and written (other European languages are a plus)You’re curious and a quick-learner💸 What you'll receiveExperience working with AI technologies, especially NLP (natural language processing)Mentoring and support from 4 senior profiles with a combined 15+ years’ experience in conversational AIAccess to conversational AI coursesThe opportunity to grow with and help build a young, innovative companyTransport to the office and lunches are on us‍Apply nowCompanyWorkPartnersJobsResourcesBlogThe Best Bots 2022AboutAbout CampfirePrivacy policyCopyright © 2022 Campfire AIThis site uses cookiesWe care about your data, and we'd use cookies only to improve your experience. By using this website, you accept our Cookies Policy.Accept"
